<!ELEMENT author_details (author_detail*)>
<!ELEMENT author_detail (role)>
<!ELEMENT role (#PCDATA)>
<!ATTLIST author_detail author_id IDREF #REQUIRED>
<!ATTLIST author_detail book_id IDREF #REQUIRED>